event_id_no_cnty	event_date	event_type	sub_event_type	actor1	assoc_actor_1	actor2	assoc_actor_2	region	country	admin1	admin2	admin3	location	latitude	longitude	source	notes	fatalities
40214	20 August 2020	Protests	Peaceful protest	Protesters (Ukraine)	Svoboda			Europe	Ukraine	Khmelnytskyi	Khmelnytskyi		Khmelnytskyi	49.4128	26.998	Svoboda	On 20 August 2020, members of Svoboda organised a protest in Khmelnytskyi in support of anti-government demonstrations in Belarus. [size=no report]	0
40221	20 August 2020	Protests	Peaceful protest	Protesters (Ukraine)	Svoboda			Europe	Ukraine	Khmelnytskyi	Shepetivka		Shepetivka	50.1855	27.0637	Svoboda	On 20 August 2020, members of Svoboda organised a protest in Shepetivka, Khmelnytskyi, in support of anti-government demonstrations in Belarus. [size=no report]	0
40212	19 August 2020	Protests	Peaceful protest	Protesters (Ukraine)	Svoboda			Europe	Ukraine	Kherson	Kalanchak		Kalanchak	46.2562	33.2907	Flot 2017	On 19 August 2020, people, including members of Svoboda, protested near Kalanchak, Kherson, demanding the liberation of Crimea and freedom for Ukrainian Crimean residents to cross the checkpoint to the mainland. [size=no report]	0
40226	18 August 2020	Protests	Peaceful protest	Protesters (Ukraine)	Students (Ukraine)			Europe	Ukraine	Kiev City	Kiev		Kiev-Shevchenkivskyi	50.4646	30.4655	Stop Corruption	On 18 August 2020, students protested outside the Ministry of Education in Kiev-Shevchenkivskyi demanding that the Ministry solve the issue with an unlicensed medical college. [size=no report]	0
40224	18 August 2020	Protests	Peaceful protest	Protesters (Ukraine)	National Corps Party			Europe	Ukraine	Kiev City	Kiev		Kiev-Pecherskyi	50.427	30.5454	National Corps	On 18 August 2020, several dozen people, including members of National Corps, protested outside the Ministry of Justice in Kiev-Pecherskyi demanding the prohibition of pro-Russian parties, in particular Opposition Platform - For Life and Party of Shariy. [size=several dozen]	0
40207	17 August 2020	Protests	Peaceful protest	Protesters (Ukraine)				Europe	Ukraine	Donetsk	Kramatorsk Municipality		Kramatorsk	48.7306	37.5816	Sprotyv	On 17 August 2020, people protested outside the regional state administration in Kramatorsk, Donetsk, demanding information about the investigation into the involvement of a former mayor of Slovyansk into the killing of an SBU officer. [size=no report]	0
40205	17 August 2020	Protests	Peaceful protest	Protesters (Ukraine)				Europe	Ukraine	Kiev City	Kiev		Kiev-Pecherskyi	50.427	30.5454	UA:Pershiy	On 17 August 2020, about 30 people protested outside the Presidential Office in Kiev-Pecherskyi demanding the inclusion of a Ukrainian activist recently arrested in Crimea in the next prisoners exchange. [size=about 30]	0
40204	17 August 2020	Strategic developments	Looting/property destruction	Unidentified Armed Group (Ukraine)		Civilians (Ukraine)	Journalists (Ukraine)	Europe	Ukraine	Kiev	Brovary		Brovary	50.5181	30.8067	UA:Pershiy; Reporter-ua; Novoye Vremya Ukraine; Segodnya	Property destruction: On 17 August 2020, unidentified individuals set fire to a car of a journalist of an investigative programme in Brovary, Kiev. No injuries were reported.	0
40421	17 August 2020	Protests	Peaceful protest	Protesters (Ukraine)	Farmers (Ukraine)			Europe	Ukraine	Luhansk	Severodonetsk		Severodonetsk	48.9467	38.4914	Sayt Goroda Severodonetska	"On 17 August 2020, workers of four horse farms protested in Severodonetsk, Luhansk, against the ""elimination of the horse-breeding sector"". [size=no report]"	0
40203	16 August 2020	Protests	Peaceful protest	Protesters (Ukraine)				Europe	Ukraine	Kiev City	Kiev		Kiev-Shevchenkivskyi	50.4646	30.4655	UA:Pershiy; Unian	On 16 August 2020, about 250 people gathered in Kiev-Shevchenkivskyi in support of anti-government protests in Belarus. [size=about 250]	0
40223	15 August 2020	Protests	Peaceful protest	Protesters (Ukraine)	National Corps Party			Europe	Ukraine	Kherson	Kherson Municipality		Kherson	46.6558	32.6178	National Corps	On 15 August 2020, about 50 people, including members of National Corps, protested in Kherson against an environmentally harmful plant. [size=about 50]	0
40152	15 August 2020	Protests	Peaceful protest	Protesters (Ukraine)	Protesters (Belarus)			Europe	Ukraine	Kiev City	Kiev		Kiev-Shevchenkivskyi	50.4646	30.4655	Segodnya; Novoye Vremya Ukraine; 24 Channel	On 15 August 2020, hundreds of people, including citizens of Belarus, protested in Kiev-Shevchenkivskyi in support of demonstrations in Belarus against the official results of the latest presidential election in which Lukashenko was announced to have received 80% of the votes. [size=hundreds]	0
40148	14 August 2020	Protests	Peaceful protest	Protesters (Ukraine)	Students (Ukraine); Stop Corruption			Europe	Ukraine	Kiev City	Kiev		Kiev-Shevchenkivskyi	50.4646	30.4655	Stop Corruption	On 14 August 2020, students and members of Stop Corruption protested outside the Ministry of Education in Kiev-Shevchenkivskyi demanding that the Ministry solve the issue with a medical college that has not issued diplomas to its graduates. [size=no report]	0
40145	14 August 2020	Protests	Peaceful protest	Protesters (Ukraine)	Svoboda; OUN: Organization of Ukrainian Nationalists			Europe	Ukraine	Kiev City	Kiev		Kiev-Solomyanskyi	50.4267	30.4538	Svoboda	On 14 August 2020, members of Svoboda and OUN protested outside the Embassy of Russia in Kiev-Solomyanskyi against the arrest of a Ukrainian activist in Crimea. [size=no report]	0
40150	14 August 2020	Protests	Peaceful protest	Protesters (Ukraine)				Europe	Ukraine	Kharkiv	Kharkiv		Kharkiv	49.9808	36.2527	Flot 2017	On 14 August 2020, people protested outside the Consulate of Russia in Kharkiv against the arrest of a Ukrainian activist in Crimea. [size=no report]	0
40236	14 August 2020	Protests	Peaceful protest	Protesters (Ukraine)				Europe	Ukraine	Dnipropetrovsk	Dnipro		Dnipro	48.4593	35.0386	UA:Dnipro	On 14 August 2020, about 50 people gathered in Dnipro in support of anti-government protests in Belarus. [size=about 50]	0
40155	14 August 2020	Protests	Peaceful protest	Protesters (Ukraine)				Europe	Ukraine	Kiev City	Kiev		Kiev-Pecherskyi	50.427	30.5454	Ukraine General Newswire	On 14 August 2020, several hundred Luhansk residents protested outside the Presidential Office in Kiev-Pecherskyi against the decision of the Central Electoral Commission to cancel the 2020 local elections in Donbas region due to security concerns. [size=several hundred]	0
40149	14 August 2020	Protests	Peaceful protest	Protesters (Ukraine)	Traditions and Order			Europe	Ukraine	Kharkiv	Kharkiv		Kharkiv	49.9808	36.2527	Tradition and Order; OSCE SMM-Ukraine	On 14 August 2020, around 500 people, including members of Traditions and Order, protested in Kharkiv in support of demonstrations in Belarus against the official results of the latest presidential election in which Lukashenko was announced to have received 80% of the votes. [size=around 500]	0
40238	14 August 2020	Protests	Peaceful protest	Protesters (Ukraine)	Svoboda			Europe	Ukraine	Lviv	Lviv Municipality		Lviv	49.8407	24.0305	Vholos	On 14 August 2020, several dozen members of Svoboda protested outside the Consulate of Russia in Lviv against the arrest of a Ukrainian activist in Crimea. [size=several dozen]	0
40153	14 August 2020	Protests	Peaceful protest	Protesters (Ukraine)				Europe	Ukraine	Kiev City	Kiev		Kiev-Shevchenkivskyi	50.4646	30.4655	Ukraine General Newswire; OSCE SMM-Ukraine	On 14 August 2020, about 20 people protested outside the Embassy of Belarus in Kiev-Shevchenkivskyi in support of demonstrations in Belarus against the official results of the latest presidential election in which Lukashenko was announced to have received 80% of the votes. [size=about 20]	0
40240	14 August 2020	Protests	Peaceful protest	Protesters (Ukraine)				Europe	Ukraine	Lviv	Lviv Municipality		Lviv	49.8407	24.0305	Vholos	On 14 August 2020, several dozen people protested in Lviv against persecution of public activists and demanding the resignation of the head of the Interior Ministry's Lviv regional directorate. [size=several dozen]	0
40137	13 August 2020	Protests	Peaceful protest	Protesters (Ukraine)				Europe	Ukraine	Zaporizhia	Zaporizhia		Novoolenivka	47.7688	35.3683	061.ua	On 13 August 2020, about 20 people blocked a road near Novoolenivka, Zaporizhia, demanding the resumption of water supply to their houses. [size=about 20]	0
40122	13 August 2020	Protests	Peaceful protest	Protesters (Ukraine)	AI: Amnesty International; Protesters (Belarus)			Europe	Ukraine	Kiev City	Kiev		Kiev-Shevchenkivskyi	50.4646	30.4655	Crimean Human Rights Group; UA:Pershiy; Ukraine General Newswire	On 13 August 2020, about 300 people, including several citizens of Belarus, gathered for a protest organised by the Amnesty International near the Embassy of Belarus in Kiev-Shevchenkivskyi in solidarity with demonstrations in Belarus against president Lukashenko. The protesters condemned violence by law enforces and demanded the release of political prisoners. [size=about 300]	0
40239	13 August 2020	Protests	Peaceful protest	Protesters (Ukraine)	Protesters (Belarus)			Europe	Ukraine	Lviv	Lviv Municipality		Lviv	49.8407	24.0305	Zaxid	On 13 August 2020, several hundred people, including citizens of Belarus, gathered in Lviv in support of anti-government protests in Belarus. [size=several hundred]	0
40139	13 August 2020	Protests	Peaceful protest	Protesters (Ukraine)				Europe	Ukraine	Kiev City	Kiev		Kiev-Solomyanskyi	50.4267	30.4538	Segodnya	On 13 August 2020, people blocked a road in Kiev-Solomyanskyi demanding that a city developer finishes the construction of houses they invested in. [size=no report]	0
40147	12 August 2020	Protests	Peaceful protest	Protesters (Ukraine)	Solidarna Molod			Europe	Ukraine	Dnipropetrovsk	Dnipro		Dnipro	48.4593	35.0386	Solidarna Molod	On 12 August 2020, hundreds of people, including members of Solidarna Molod, protested in Dnipro against the plans of the Opposition Platform - For Life party to organise a referendum in the region. [size=hundreds]	0
40129	12 August 2020	Protests	Peaceful protest	Protesters (Ukraine)				Europe	Ukraine	Zaporizhia	Zaporizhia		Zaporizhia	47.8479	35.1602	061.ua	On 12 August 2020, several dozen people protested in Zaporizhia in support of demonstrations in Belarus against the official results of the latest presidential election in which Lukashenko was announced to have received 80% of the votes. [size=several dozen]	0
40146	12 August 2020	Protests	Peaceful protest	Protesters (Ukraine)	National Corps Party			Europe	Ukraine	Kiev City	Kiev		Kiev-Solomyanskyi	50.4267	30.4538	National Corps	On 12 August 2020, dozens of people, including members of National Corps, protested outside the Court of Appeal in Kiev-Solomyanskyi in support of one of the activists suspected of involvement in the murder of journalist Pavel Sheremet in 2016. [size=dozens]	0
40121	12 August 2020	Protests	Peaceful protest	Protesters (Ukraine)				Europe	Ukraine	Vinnytsia	Vinnytsia		Vinnytsia	49.2296	28.4659	UA:Pershiy	On 12 August 2020, people protested in Vinnytsia in support of demonstrations in Belarus against the official results of the latest presidential election in which Lukashenko was announced to have received 80% of the votes. [size=no report]	0
40120	12 August 2020	Protests	Peaceful protest	Protesters (Ukraine)				Europe	Ukraine	Kharkiv	Kharkiv		Kharkiv	49.9808	36.2527	Segodnya; UA:Pershiy; OSCE SMM-Ukraine	On 12 August 2020, around 100 people protested in Kharkiv in support of demonstrations in Belarus against the official results of the latest presidential election in which Lukashenko was announced to have received 80% of the votes. [size=around 100]	0
40127	12 August 2020	Protests	Peaceful protest	Protesters (Ukraine)				Europe	Ukraine	Lviv	Lviv Municipality		Lviv	49.8407	24.0305	Liveuamap; Telegram	On 12 August 2020, hundreds of people protested in Lviv in support of demonstrations in Belarus against the official results of the latest presidential election in which Lukashenko was announced to have received 80% of the votes. [size=hundreds]	0
40128	12 August 2020	Protests	Peaceful protest	Protesters (Ukraine)				Europe	Ukraine	Kiev City	Kiev		Kiev-Shevchenkivskyi	50.4646	30.4655	Priamyi; Liveuamap; Segodnya	On 12 August 2020, more than 100 people protested outside the Embassy of Belarus in Kiev-Shevchenkivskyi demanding the release of Ukrainian citizens arrested during protests in Belarus, expressing solidarity with Belorussian protesters and condemning violence by law enforces [size=more than 100]	0
40131	12 August 2020	Protests	Peaceful protest	Protesters (Ukraine)				Europe	Ukraine	Odessa	Odessa Municipality		Odessa	46.4639	30.7386	Segodnya	On 12 August 2020, people protested in Odessa in support of demonstrations in Belarus against the official results of the latest presidential election in which Lukashenko was announced to have received 80% of the votes. [size=no report]	0
40140	11 August 2020	Protests	Peaceful protest	Protesters (Ukraine)				Europe	Ukraine	Kiev City	Kiev		Kiev-Pecherskyi	50.427	30.5454	Stop Corruption	On 11 August 2020, people protested in Kiev-Pecherskyi demanding that a city developer finishes the construction of houses they invested in. [size=no report]	0
40132	11 August 2020	Protests	Peaceful protest	Protesters (Ukraine)				Europe	Ukraine	Kiev City	Kiev		Kiev-Shevchenkivskyi	50.4646	30.4655	Focus; Center for Civil Liberties	On 11 August 2020, hundreds of people protested outside the Embassy of Belarus in Kiev-Shevchenkivskyi in support of demonstrations in Belarus against the official results of the latest presidential election in which Lukashenko was announced to have received 80% of the votes. [size=hundreds]	0
40138	11 August 2020	Strategic developments	Looting/property destruction	Unidentified Armed Group (Ukraine)		Civilians (Ukraine)	Former Government of Ukraine (2019-)	Europe	Ukraine	Kiev City	Kiev		Kiev-Dniproskyi	50.454	30.5982	Segodnya; Stop Corruption; Reporter-ua; Novoye Vremya Ukraine	"Property destruction: On 11 August 2020, unidentified individuals set fire to the car of a former head of Zelenskyi's Presidential Office in Kiev-Dniproskyi. No injuries were reported. The victim claimed that the incident is a ""threat from the government""."	0
40144	10 August 2020	Protests	Peaceful protest	Protesters (Ukraine)				Europe	Ukraine	Kiev City	Kiev		Kiev-Pecherskyi	50.427	30.5454	24 Channel	On 10 August 2020, people protested outside the Presidential Office in Kiev-Pecherskyi demanding that the authorities check the information provided by the US Ministry of Justice on money laundering by oligarch Kolomoiskyi and extradite him to the US if he is guilty. [size=no report]	0
40143	10 August 2020	Protests	Peaceful protest	Protesters (Ukraine)				Europe	Ukraine	Kiev City	Kiev		Kiev-Pecherskyi	50.427	30.5454	24 Channel	"On 10 August 2020, people protested in Kiev-Pecherskyi demanding the resignation of the Prosecutor General Iryna Venediktova for ""sabotage of high-profile cases"". [size=no report]"	0
40125	10 August 2020	Protests	Peaceful protest	Protesters (Ukraine)				Europe	Ukraine	Kharkiv	Kharkiv		Kharkiv	49.9808	36.2527	UA:Pershiy	On 10 August 2020, people protested in Kharkiv in support of demonstrations in Belarus against the official results of the latest presidential election in which Lukashenko was announced to have received 80% of the votes. [size=no report]	0
40124	10 August 2020	Protests	Peaceful protest	Protesters (Ukraine)				Europe	Ukraine	Cherkasy	Cherkasy		Cherkasy	49.4285	32.0621	UA:Pershiy	On 10 August 2020, people protested in Cherkasy in support of demonstrations in Belarus against the official results of the latest presidential election in which Lukashenko was announced to have received 80% of the votes. [size=no report]	0
40126	10 August 2020	Protests	Peaceful protest	Protesters (Ukraine)				Europe	Ukraine	Luhansk	Severodonetsk		Severodonetsk	48.9467	38.4914	UA:Pershiy	On 10 August 2020, people protested in Severodonetsk, Luhansk, demanding that the 2020 local elections be held in Donbas. Previously, the Central Electoral Commission cancelled the elections due to security concerns. [size=no report]	0
40142	09 August 2020	Protests	Peaceful protest	Protesters (Ukraine)				Europe	Ukraine	Zakarpattia	Mukacheve		Rakoshyno	48.4652	22.596	24 Channel	On 9 August 2020, people blocked a road near Rakoshyno, Zakarpattia, in protest against the construction of a waste processing plant in the area. [size=no report]	0
40135	09 August 2020	Strategic developments	Disrupted weapons use	Police Forces of Ukraine (2019-)		Unidentified Armed Group (Ukraine)		Europe	Ukraine	Kiev City	Kiev		Kiev-Pecherskyi	50.427	30.5454	Sprotyv; 24 Channel	Defusal: On 9 August 2020, the police defused an IED planted near an office of the Opposition Platform - For Life party in Kiev-Pecherskyi.	0
40241	09 August 2020	Protests	Peaceful protest	Protesters (Ukraine)				Europe	Ukraine	Lviv	Lviv Municipality		Lviv	49.8407	24.0305	Lvivskyi Portal	On 9 August 2020, several dozen people protested in Lviv demanding that the authorities create a shelter for stray animals in the city. [size=several dozen]	0
40130	09 August 2020	Protests	Peaceful protest	Protesters (Belarus)				Europe	Ukraine	Kiev City	Kiev		Kiev-Shevchenkivskyi	50.4646	30.4655	Segodnya	On 9 August 2020, hundreds of citizens of Belarus demonstrated outside the Embassy in Belarus in Kiev-Shevchenkivskyi complaining that they did not get a chance to vote and against the preliminary results of the presidential election in which Lukashenko was announced to have received 80% of the votes. [size=hundreds]	0
40242	07 August 2020	Protests	Peaceful protest	Protesters (Ukraine)				Europe	Ukraine	Dnipropetrovsk	Dnipro		Dnipro	48.4593	35.0386	11 TV	On 7 August 2020, people protested outside the regional state administration in Dnipro demanding the cancellation of the permit for uranium mining in the region. [size=no report]	0
40083	07 August 2020	Protests	Peaceful protest	Protesters (Ukraine)	National Corps Party			Europe	Ukraine	Donetsk	Pershotravnevy		Manhush	47.0558	37.3107	National Corps	On 7 August 2020, members of National Corps and local residents protested in Manhush, Donetsk, demanding the repair of roads. [size=no report]	0
40070	06 August 2020	Protests	Peaceful protest	Protesters (Ukraine)				Europe	Ukraine	Donetsk	Snizhne Municipality		Snizhne	48.0299	38.7662	Sputnik News Service	On 6 August 2020, about 50 people gathered near Snizhne, Donetsk, to mourn the death of Russian correspondents who were killed during clashes in 2014 and condemn the Ukrainian military offensive against the separatist-held territories. [size=about 50]	0
40243	06 August 2020	Protests	Peaceful protest	Protesters (Ukraine)	Labour Group (Ukraine)			Europe	Ukraine	Kharkiv	Kharkiv		Kharkiv	49.9808	36.2527	StatusQuo	On 6 August 2020, workers of a local plant protested in Kharkiv demanding that their wage arrears be cleared. [size=no report]	0
40085	06 August 2020	Protests	Peaceful protest	Protesters (Ukraine)	Stop Corruption			Europe	Ukraine	Vinnytsia	Vinnytsia		Vinnytsia	49.2296	28.4659	Stop Corruption	On 6 August 2020, members of Stop Corruption protested in Vinnytsia against corruption, illegal construction and demanding resignation of the first deputy prosecutor of the region over abuse of power allegations. [size=no report]	0
40081	06 August 2020	Protests	Peaceful protest	Protesters (Ukraine)				Europe	Ukraine	Ivano-Frankivsk	Bohorodchany		Hlybivka	48.7951	24.4525	24 Channel	On 6 August 2020, about 100 people blocked a road in Hlybivka, Ivano-Frankivsk, demanding its repair. [size=about 100]	0
40086	05 August 2020	Protests	Peaceful protest	Protesters (Ukraine)	Stop Corruption			Europe	Ukraine	Kiev City	Kiev		Kiev-Pecherskyi	50.427	30.5454	Stop Corruption	On 5 August 2020, members of Stop Corruption protested outside the Cabinet of Ministers in Kiev-Pecherskyi demanding reaction to the two private Russian tug boats providing services in the Ukrainian port and demanding protection of the state tug services. [size=no report]	0
40080	05 August 2020	Protests	Peaceful protest	Protesters (Ukraine)				Europe	Ukraine	Ivano-Frankivsk	Ivano-Frankivsk Municipality		Ivano-Frankivsk	48.9215	24.7097	24 Channel	On 5 August 2020, about 100 people protested in Ivano-Frankivsk against the possible closure of gyms due to the increase in coronavirus cases. [size=about 100]	0
40075	05 August 2020	Strategic developments	Disrupted weapons use	Police Forces of Ukraine (2019-) Security Service of Ukraine		Unidentified Armed Group (Ukraine)		Europe	Ukraine	Donetsk	Marynsky		Marinka	47.9425	37.505	Liveuamap; Security Services of Ukraine	Weapons seizure: Around 5 August 2020 (as reported), the Security Service of Ukraine found and seized a cache of weapons near Marinka, Donetsk, consisting of 5kg TNT, 3kg of plastic explosives, over 30 grenades, four mines, a rifle and over 1000 cartridges.	0
40084	04 August 2020	Protests	Peaceful protest	Protesters (Ukraine)	National Corps Party			Europe	Ukraine	Odessa	Odessa Municipality		Odessa	46.4639	30.7386	National Corps	On 4 August 2020, members of National Corps protested in Odessa against the illegal construction. [size=no report]	0
40077	04 August 2020	Protests	Peaceful protest	Protesters (Ukraine)				Europe	Ukraine	Kiev City	Kiev		Kiev-Shevchenkivskyi	50.4646	30.4655	Focus; Segodnya	On 4 August 2020, dozens of people protested in Kiev-Shevchenkivskyi against the 5G network, claiming it has negative impact on health. [size=dozens]	0
40082	03 August 2020	Protests	Peaceful protest	Protesters (Ukraine)				Europe	Ukraine	Kiev City	Kiev		Kiev-Shevchenkivskyi	50.4646	30.4655	Center for Civil Liberties	On 3 August 2020, people protested in Kiev-Shevchenkivskyi demanding the release of Ukrainian political prisoners held in Russia. [size=no report]	0
40076	03 August 2020	Protests	Peaceful protest	Protesters (Ukraine)				Europe	Ukraine	Ternopil	Ternopil		Ternopil	49.5559	25.6056	Segodnya; 24 Channel; Novoye Vremya Ukraine	On 3 August 2020, people protested in Ternopil demanding that trains transiting through the city make a stop there. The railway company cancelled the stop due to high number of new coronavirus cases in the city. [size=no report]	0
40079	01 August 2020	Strategic developments	Looting/property destruction	Unidentified Armed Group (Ukraine)		Civilians (Ukraine)	Government of Ukraine (2019-)	Europe	Ukraine	Kiev City	Kiev		Kiev-Desnianskyi	50.5097	30.6717	Focus; 24 Channel	Property destruction: On 1 August 2020, an unidentified individual destroyed an entry-exit checkpoint to an island in Kiev-Desnianskyi, installed by the city administration. He claimed to the police that he considers it to be illegal to limit people's access to this territory.	0
40068	01 August 2020	Protests	Peaceful protest	Protesters (Ukraine)				Europe	Ukraine	Kiev City	Kiev		Kiev	50.4496	30.5224	UA:Pershiy	On 1 August 2020, people staged a protest in Kiev in support of democracy and human rights in Belarus ahead of the presidential election. [size=no report]	0
40067	01 August 2020	Protests	Peaceful protest	Protesters (Ukraine)				Europe	Ukraine	Kherson	Kalanchak		Kalanchak	46.2562	33.2907	UA:Pershiy	On 1 August 2020, people held a car procession in the area of Kalanchak, Kherson, in support of unity between Ukraine and Crimea. [size=no report]	0
40016	01 August 2020	Protests	Peaceful protest	Protesters (Ukraine)				Europe	Ukraine	Sumy	Sumy		Sumy	50.9216	34.8003	Focus	On 1 August 2020, people protested in Sumy demanding action against a group of teenagers suspected of stealing and rape. [size=no report]	0
