event_id_no_cnty	event_date	event_type	sub_event_type	actor1	assoc_actor_1	actor2	assoc_actor_2	region	country	admin1	admin2	admin3	location	latitude	longitude	source	notes	fatalities
40381	03 September 2020	Protests	Peaceful protest	Protesters (Ukraine)				Europe	Ukraine	Cherkasy	Cherkasy		Cherkasy	49.4285	32.0621	24 Channel	On 3 September 2020, people protested in Cherkasy demanding the release of those involved in the attack on a bus with Patriots - For Life members. [size=no report]	0
40394	03 September 2020	Protests	Peaceful protest	Protesters (Ukraine)	Traditions and Order			Europe	Ukraine	Sumy	Sumy		Sumy	50.9216	34.8003	Tradition and Order	On 3 September 2020, people, including members of Traditions and Order, protested in Sumy demanding the release of those involved in the attack on a bus with Patriots - For Life members. [size=no report]	0
40386	03 September 2020	Protests	Peaceful protest	Protesters (Ukraine)	Traditions and Order; Right Sector; Freikorps; Former Military Forces of Ukraine (2019-)			Europe	Ukraine	Kharkiv	Kharkiv		Kharkiv	49.9808	36.2527	24 Channel; Tradition and Order; Obyektiv Novosti	On 3 September 2020, dozens of people, including members of Traditions and Order, Right Sector, Freikorps and Donbas veterans, protested in Kharkiv demanding the release of those involved in the attack on a bus with Patriots - For Life members. [size=dozens]	0
40547	03 September 2020	Protests	Peaceful protest	Protesters (Ukraine)	Labour Group (Ukraine)			Europe	Ukraine	Dnipropetrovsk	Kryvyi Rih		Kryvyi Rih	47.9093	33.3933	Dnepr Vecherniy	On 3 September 2020, coal miners protested in Kryvyi Rih in support of miners who went on strike and refused to rise to the surface after their shift. The protesters demand higher salaries and better work conditions. [size=no report]	0
40380	02 September 2020	Protests	Peaceful protest	Protesters (Ukraine)				Europe	Ukraine	Kiev City	Kiev		Kiev-Pecherskyi	50.427	30.5454	Segodnya; 24 Channel	On 2 September 2020, owners of cars with foreign registration protested near the Parliament in Kiev-Pecherskyi demanding affordable custom clearance of cars. [size=no report]	0
40364	01 September 2020	Protests	Peaceful protest	Protesters (Ukraine)	Democratic Axe Party			Europe	Ukraine	Kiev City	Kiev		Kiev-Shevchenkivskyi	50.4646	30.4655	Liveuamap; Demokratychna Sokyra; 24 Channel	On 1 September 2020, people, including members of Democratic Axe, protested outside the Supreme Council of Justice in Kiev-Shevchenkivskyi demanding the dismissal of a judge accused of unprofessionalism and abuse of power. [size=no report]	0
40372	01 September 2020	Strategic developments	Disrupted weapons use	Police Forces of Ukraine (2019-)		Unidentified Armed Group (Ukraine)		Europe	Ukraine	Luhansk	Novoaidarsky		Koliadivka	49.0912	39.21	Security Services of Ukraine; Liveuamap	Weapons seizure: On 1 September 2020, the police found and seized a cache of weapons in Koliadivka, Luhansk, consisting of two grenade launchers, 66 artillery shells, eight grenades, an anti-tank mine and over 7000 cartridges of various calibre.	0
40375	01 September 2020	Protests	Peaceful protest	Protesters (Ukraine)	Labour Group (Ukraine)			Europe	Ukraine	Kiev City	Kiev		Kiev-Pecherskyi	50.427	30.5454	24 Channel; Novoye Vremya Ukraine; Ukrinform; Liveuamap	On 1 September 2020, several hundred people, including musicians and concert organisers, protested outside the Cabinet of Ministers in Kiev-Pecherskyi against restrictions on organising concerts and entertainment events due to the coronavirus lockdown. [size=several hundred]	0
40721	01 September 2020	Protests	Peaceful protest	Protesters (Ukraine)	Traditions and Order			Europe	Ukraine	Odessa	Odessa Municipality		Odessa	46.4639	30.7386	Tradition and Order	On 1 September 2020, members of Traditions and Order protested outside a court in Odessa demanding the release of an activist arrested while protesting an LGBT march the day before. [size=no report]	0
40377	01 September 2020	Protests	Peaceful protest	Protesters (Ukraine)				Europe	Ukraine	Kiev City	Kiev		Kiev-Pecherskyi	50.427	30.5454	24 Channel	On 1 September 2020, people protested outside the Supreme Court in Kiev-Pecherskyi demanding that the court hearings in the case against activist Serhiy Sternenko be held in Kiev instead of Odessa. [size=no report]	0
40376	01 September 2020	Protests	Peaceful protest	Protesters (Ukraine)	Students (Ukraine)			Europe	Ukraine	Kiev City	Kiev		Kiev-Pecherskyi	50.427	30.5454	24 Channel	On 1 September 2020, dozens of students protested outside the Cabinet of Ministers in Kiev-Pecherskyi demanding resignation of the acting Minister of Education Serhiy Shkarlet over plagiarism and corruption allegations. [size=dozens]	0
40374	01 September 2020	Protests	Peaceful protest	Protesters (Ukraine)	Labour Group (Ukraine)			Europe	Ukraine	Ivano-Frankivsk	Ivano-Frankivsk Municipality		Ivano-Frankivsk	48.9215	24.7097	Segodnya	On 1 September 2020, entrepreneurs protested in Ivano-Frankivsk demanding the permission to work amidst the coronavirus lockdown. [size=no report]	0
40369	31 August 2020	Strategic developments	Disrupted weapons use	Police Forces of Ukraine (2019-)		Unidentified Armed Group (Ukraine)		Europe	Ukraine	Kharkiv	Liubotyn Municipality		Liubotyn	49.9469	35.9291	UA:Pershiy; Ukraine General Newswire	Weapons seizure: Around 31 August 2020 (as reported), the police found and seized a cache of weapons in Liubotyn, Kharkiv, consisting of over five kilogrammes of TNT, seven kilogrammes of plastic explosives, 668 missiles, 62 000 cartridges of various calibre and other military equipment.	0
40370	31 August 2020	Protests	Peaceful protest	Protesters (Ukraine)	Labour Group (Ukraine)			Europe	Ukraine	Ivano-Frankivsk	Ivano-Frankivsk Municipality		Ivano-Frankivsk	48.9215	24.7097	24 Channel; Segodnya; LIGA.net; UA:Pershiy	On 31 August 2020, hundreds of people, including entrepreneurs, protested in Ivano-Frankivsk against the coronavirus-related restrictions on their work. [size=hundreds]	0
40371	31 August 2020	Protests	Protest with intervention	Protesters (Ukraine)		Police Forces of Ukraine (2019-)		Europe	Ukraine	Kiev City	Kiev		Kiev-Pecherskyi	50.427	30.5454	Stop Corruption	On 31 August 2020, people protested in Kiev-Pecherskyi against the Servant of the People party. The police dispersed the protesters. [size=no report]	0
40818	31 August 2020	Protests	Peaceful protest	Protesters (Ukraine)	Protesters (Belarus)			Europe	Ukraine	Kiev City	Kiev		Kiev-Shevchenkivskyi	50.4646	30.4655	Charter-97	On 31 August 2020, several dozen people, including citizens of Belarus, protested in Kiev-Shevchenkivskyi in support of anti-governmental demonstration in Belarus. The protesters burned the Russian flag. [size=several dozen]	0
40366	30 August 2020	Protests	Peaceful protest	Protesters (Ukraine)				Europe	Ukraine	Kiev City	Kiev		Kiev-Shevchenkivskyi	50.4646	30.4655	Liveuamap; Hromadske Radio; Novoye Vremya Ukraine	On 30 August 2020, several dozen people protested in Kiev-Shevchenkivskyi demanding free elections in Belarus. [size=several dozen]	0
40367	30 August 2020	Protests	Peaceful protest	Protesters (Ukraine)	National Corps Party			Europe	Ukraine	Zaporizhia	Zaporizhia		Zaporizhia	47.8479	35.1602	061.ua; National Corps	On 30 August 2020, people, including members of National Corps, protested outside a court in Zaporizhia demanding the release of activists who damaged Opposition Platform - For Life campaigning tents. [size=no report]	0
40368	30 August 2020	Protests	Protest with intervention	Protesters (Ukraine)	LGBT (Ukraine); Police Forces of Ukraine (2019-)	Rioters (Ukraine)	Traditions and Order; National Corps Party	Europe	Ukraine	Odessa	Odessa Municipality		Odessa	46.4639	30.7386	Ukraine General Newswire; OSCE SMM-Ukraine; Segodnya; Interfax	On 30 August 2020, about 30 people held a march in Odessa in support of LGBT rights. About 100 people, including members of Traditions and Order and National Corps, sprayed gas at the marchers and clashed with the police guarding the protesters. Two police officers were wounded, 16 people were arrested. [size=about 130]	0
40266	29 August 2020	Protests	Peaceful protest	Protesters (Ukraine)	National Corps Party			Europe	Ukraine	Lviv	Lviv Municipality		Lviv	49.8407	24.0305	24 Channel; National Corps	On 29 August 2020, about 30 people, including members of National Corps, protested outside a police department in Lviv demanding the release of those who attacked the bus with Patriots - For Life members and the prohibition of pro-Russian parties in Ukraine. [size=about 30]	0
40267	29 August 2020	Protests	Peaceful protest	Protesters (Ukraine)	National Corps Party			Europe	Ukraine	Kiev City	Kiev		Kiev	50.4496	30.5224	24 Channel; National Corps	On 29 August 2020, people, including members of National Corps, protested outside a police department in Kiev demanding the release of those who attacked the bus with Patriots - For Life members and the prohibition of pro-Russian parties in Ukraine. [size=no report]	0
40268	29 August 2020	Protests	Peaceful protest	Protesters (Ukraine)	National Corps Party			Europe	Ukraine	Volyn	Lutsk		Lutsk	50.7593	25.3424	24 Channel; National Corps	On 29 August 2020, people, including members of National Corps, protested outside a police department in Lutsk demanding the release of those who attacked the bus with Patriots - For Life members and the prohibition of pro-Russian parties in Ukraine. [size=no report]	0
40269	29 August 2020	Protests	Peaceful protest	Protesters (Ukraine)	National Corps Party			Europe	Ukraine	Zhytomyr	Zhytomyr		Zhytomyr	50.2649	28.6767	24 Channel; National Corps	On 29 August 2020, people, including members of National Corps, protested outside a police department in Zhytomyr demanding the release of those who attacked the bus with Patriots - For Life members and the prohibition of pro-Russian parties in Ukraine. [size=no report]	0
40270	29 August 2020	Protests	Peaceful protest	Protesters (Ukraine)	National Corps Party			Europe	Ukraine	Vinnytsia	Vinnytsia		Vinnytsia	49.2296	28.4659	National Corps; 24 Channel	On 29 August 2020, people, including members of National Corps, protested outside a police department in Vinnytsia demanding the release of those who attacked the bus with Patriots - For Life members and the prohibition of pro-Russian parties in Ukraine. [size=no report]	0
40271	29 August 2020	Protests	Peaceful protest	Protesters (Ukraine)	National Corps Party			Europe	Ukraine	Kharkiv	Kharkiv		Kharkiv	49.9808	36.2527	24 Channel; National Corps	On 29 August 2020, people, including members of National Corps, protested outside a police department in Kharkiv demanding the release of those who attacked the bus with Patriots - For Life members and the prohibition of pro-Russian parties in Ukraine. [size=no report]	0
40272	29 August 2020	Protests	Peaceful protest	Protesters (Ukraine)	Labour Group (Ukraine); Teachers (Ukraine)			Europe	Ukraine	Chernivtsi	Chernivtsi Municipality		Chernivtsi	48.2915	25.9403	24 Channel; Novoye Vremya Ukraine	On 29 August 2020, several dozen people, including business owners and teachers, protested in Chernivtsi against possible new restrictions to their work due to the increase in coronavirus cases in the region. [size=several dozen]	0
40260	28 August 2020	Protests	Peaceful protest	Protesters (Ukraine)	Students (Ukraine)			Europe	Ukraine	Kiev City	Kiev		Kiev-Pecherskyi	50.427	30.5454	Stop Corruption	On 28 August 2020, students protested outside the Cabinet of Ministers in Kiev-Pecherskyi demanding that the authorities solve the issue around an unlicensed medical college. [size=no report]	0
40257	28 August 2020	Protests	Peaceful protest	Protesters (Ukraine)	National Corps Party			Europe	Ukraine	Kiev City	Kiev		Kiev-Pecherskyi	50.427	30.5454	National Corps	On 28 August 2020, members of National Corps protested outside the Prosecutor General's Office in Kiev-Pecherskyi demanding the resignation of a prosecutor who holds the Russian citizenship. [size=no report]	0
40273	28 August 2020	Protests	Peaceful protest	Protesters (Ukraine)	Former Military Forces of Ukraine (2019-)			Europe	Ukraine	Kiev City	Kiev		Kiev-Solomyanskyi	50.4267	30.4538	24 Channel	On 28 August 2020, about 150 veterans and relatives of those who died during the war in Donbas protested outside the Russian Embassy in Kiev-Solomyanskyi demanding investigation into the battles of Ilovaisk, Debaltseve and Sloviansk in 2014. [size=about 150]	0
40250	28 August 2020	Protests	Peaceful protest	Protesters (Ukraine)				Europe	Ukraine	Cherkasy	Umanskyi		Uman	48.7484	30.2218	LIGA.net; Stop Corruption; Novoye Vremya Ukraine	On 28 August 2020, people protested in Uman, Cherkasy, trying to block the way for a Jewish procession to the grave of the founder of the Breslov Hasidic movement. The protesters claimed that the building near the grave was constructed illegally and raised concerns about the spread of coronavirus. [size=no report]	0
40264	28 August 2020	Strategic developments	Looting/property destruction	Unidentified Armed Group (Ukraine)		Civilians (Ukraine)	Government of Ukraine (2019-); Servant of the People	Europe	Ukraine	Kiev City	Kiev		Kiev	50.4496	30.5224	Novoye Vremya Ukraine; 24 Channel; Reporter-ua; Segodnya	Property destruction: On 28 August 2020, unidentified individuals set fire to a car of a member of Parliament from the Servant of the People party in Kiev. No injuries were reported.	0
40274	28 August 2020	Protests	Peaceful protest	Protesters (Ukraine)	Labour Group (Ukraine)			Europe	Ukraine	Kiev City	Kiev		Kiev-Pecherskyi	50.427	30.5454	24 Channel; Ukrainian News Agency; OSCE SMM-Ukraine	On 28 August 2020, about 100 workers of the tourism sector and concert organisers protested outside the Cabinet of Ministers in Kiev-Pecherskyi against the prohibition of entry into Ukraine for foreigners and other coronavirus-related restrictions. [size=about 100]	0
40261	26 August 2020	Protests	Peaceful protest	Protesters (Ukraine)	Students (Ukraine)			Europe	Ukraine	Kiev City	Kiev		Kiev-Shevchenkivskyi	50.4646	30.4655	Stop Corruption	On 26 August 2020, about 35 students protested outside the Ministry of Education in Kiev-Shevchenkivskyi demanding that the authorities solve the issue around an unlicensed medical college. [size=about 35]	0
40262	26 August 2020	Protests	Protest with intervention	Protesters (Ukraine)		Police Forces of Ukraine (2019-)	Government of Ukraine (2019-)	Europe	Ukraine	Dnipropetrovsk	Dnipro		Dnipro	48.4593	35.0386	Stop Corruption	"On 26 August 2020, people protested in Dnipro ""against capitulation"" in the war in Donbas during the President's visit to the city. The police and the President's guards pushed away the protesters causing rib fracture to one of them. [size=no report]"	0
40244	26 August 2020	Protests	Peaceful protest	Protesters (Ukraine)				Europe	Ukraine	Zaporizhia	Zaporizhia		Zaporizhia	47.8479	35.1602	061.ua	On 26 August 2020, several dozen people protested in Zaporizhia demanding the construction of a residential house they invested in. [size=several dozen]	0
40245	26 August 2020	Protests	Peaceful protest	Protesters (Ukraine)	Democratic Axe Party			Europe	Ukraine	Zaporizhia	Zaporizhia		Zaporizhia	47.8479	35.1602	061.ua	On 26 August 2020, members of Democratic Axe protested against corruption outside the city council in Zaporizhia. [size=no report]	0
40258	26 August 2020	Protests	Peaceful protest	Protesters (Ukraine)	National Corps Party			Europe	Ukraine	Odessa	Odessa Municipality		Odessa	46.4639	30.7386	National Corps	On 26 August 2020, members of National Corps protested in Odessa demanding the restoration of a historic building. [size=no report]	0
40253	26 August 2020	Protests	Peaceful protest	Protesters (Ukraine)	Labour Group (Ukraine)			Europe	Ukraine	Ivano-Frankivsk	Kolomyia		Kolomyia	48.53	25.0412	LIGA.net	On 26 August 2020, owners and employees of businesses protested in Kolomyia, Ivano-Frankivsk, against possible new lockdown restrictions due to the increase in coronavirus cases in their region. [size=no report]	0
40249	26 August 2020	Protests	Peaceful protest	Protesters (Ukraine)				Europe	Ukraine	Chernivtsi	Kitsman		Mamaivtsi	48.3526	25.8232	Segodnya	On 26 August 2020, people blocked a road in Mamaivtsi, Chernivtsi, against possible new lockdown restrictions due to the increase in coronavirus cases in their region. [size=no report]	0
40246	25 August 2020	Protests	Peaceful protest	Protesters (Ukraine)				Europe	Ukraine	Kiev City	Kiev		Kiev-Shevchenkivskyi	50.4646	30.4655	Segodnya	On 25 August 2020, people blocked a road and lit flares near a court in Kiev-Shevchenkivskyi demanding the release of a suspect in the murder of journalist Pavel Sheremet. The protesters claimed that real killers are still at large. [size=no report]	0
40231	25 August 2020	Protests	Peaceful protest	Protesters (Ukraine)				Europe	Ukraine	Kiev City	Kiev		Kiev-Shevchenkivskyi	50.4646	30.4655	UA:Pershiy	On 25 August 2020, people gathered in Kiev-Shevchenkivskyi in support of anti-government protests in Belarus. [size=no report]	0
40247	25 August 2020	Protests	Peaceful protest	Protesters (Ukraine)	Labour Group (Ukraine)			Europe	Ukraine	Rivne	Ostroh		Ostroh	50.3294	26.5143	Novoye Vremya Ukraine; Segodnya	On 25 August 2020, several dozen entrepreneurs protested in Ostroh, Rivne, against possible new restrictions to their work due to the increase in coronavirus cases in their region. [size=several dozen]	0
40248	25 August 2020	Protests	Peaceful protest	Protesters (Ukraine)	Labour Group (Ukraine)			Europe	Ukraine	Chernivtsi	Chernivtsi Municipality		Chernivtsi	48.2915	25.9403	Focus; Segodnya; Novoye Vremya Ukraine	On 25 August 2020, about 500-1000 people, including entrepreneurs, employees of restaurants and gyms, protested in Chernivtsi against possible new restrictions to their work due to the increase in coronavirus cases in their region. [size=about 500-1000]	0
40259	24 August 2020	Protests	Peaceful protest	Protesters (Ukraine)	National Corps Party			Europe	Ukraine	Lviv	Lviv Municipality		Lviv	49.8407	24.0305	National Corps	On 24 August 2020, at least 50 people, including members of National Corps, held a march in Lviv dedicated to the Independence Day of Ukraine and demanded the deoccupation of Donbas and Crimea. [size=at least 50]	0
40254	24 August 2020	Protests	Peaceful protest	Protesters (Ukraine)	Svoboda; Right Sector			Europe	Ukraine	Zaporizhia	Zaporizhia		Zaporizhia	47.8479	35.1602	Svoboda	On 24 August 2020, several hundred people, including members of Svoboda and Right Sector, protested in Zaporizhia demanding the prohibition of pro-Russian parties in Ukraine. [size=several hundred]	0
40252	24 August 2020	Protests	Peaceful protest	Protesters (Ukraine)	Former Military Forces of Ukraine (2019-); Azov Battalion; National Corps Party			Europe	Ukraine	Kiev City	Kiev		Kiev-Pecherskyi	50.427	30.5454	24 Channel	On 24 August 2020, veterans from Azov Battalion and members of National Corps protested outside the Presidential Office in Kiev-Pecherskyi demanding the adoption of the law on collaborationism and responsibility for pro-Russian politicians. [size=no report]	0
40237	24 August 2020	Protests	Peaceful protest	Protesters (Ukraine)	Military Forces of Ukraine (2019-); Former Military Forces of Ukraine (2019-); Svoboda; Right Sector; National Corps Party; Democratic Axe Party; Solidarna Molod			Europe	Ukraine	Kiev City	Kiev		Kiev-Shevchenkivskyi	50.4646	30.4655	Novoye Vremya Ukraine; Svoboda; 24 Channel; AFP; Ukrayinska Pravda	On 24 August 2020, about 30 000 people, including former and current soldiers, members of Svoboda, Right Sector, National Corps, Democratic Axe and Solidarna Molod, gathered for an unofficial veterans' march in Kiev-Shevchenkivskyi organised due to the cancellation of an annual military parade. The columns of people held banners with various political demands, including the end of the war in Donbas on the Ukrainian terms, the end of the occupation of Crimea, the release of political prisoners, no persecution of activists and free elections in Belarus. [size=about 30 000]	0
40251	24 August 2020	Protests	Peaceful protest	Protesters (Ukraine)				Europe	Ukraine	Kiev City	Kiev		Kiev-Pecherskyi	50.427	30.5454	Focus; Novoye Vremya Ukraine	On 24 August 2020, several hundred people protested outside the office of the Prosecutor General in Kiev-Pecherskyi in support of the suspects in the murder of journalist Pavel Sheremet. The protesters demanded that the authorities release innocent people and search for the actual perpetrators. [size=several hundred]	0
40255	24 August 2020	Protests	Peaceful protest	Protesters (Ukraine)	Right Sector; Traditions and Order			Europe	Ukraine	Kharkiv	Kharkiv		Kharkiv	49.9808	36.2527	Stop Corruption; Right Sector; Tradition and Order	On 24 August 2020, about 1000 people, including members of Right Sector and Traditions and Order, held a march in Kharkiv dedicated to the Independence Day of Ukraine and demanded the deoccupation of Donbas and Crimea. [size=about 1000]	0
40256	24 August 2020	Protests	Peaceful protest	Protesters (Ukraine)	Right Sector			Europe	Ukraine	Dnipropetrovsk	Kryvyi Rih		Kryvyi Rih	47.9093	33.3933	Right Sector	On 24 August 2020, people, including members of Right Sector, held a march in Kryvyi Rih, Dnipropetrovsk, dedicated to the Independence Day of Ukraine and demanded the deoccupation of Donbas and Crimea. [size=no report]	0
40233	23 August 2020	Protests	Peaceful protest	Protesters (Ukraine)				Europe	Ukraine	Donetsk	Horlivka Municipality		Mayorsk	48.3798	38.0067	Novoye Vremya Ukraine	On 23 August 2020, about a dozen people gathered in Mayorsk, Donetsk, to protest the occupation of the Donbass region. They also brought a flag of Belarus in support of anti-government protests there. [size=about a dozen]	0
40232	23 August 2020	Protests	Peaceful protest	Protesters (Ukraine)	Protesters (Belarus)			Europe	Ukraine	Kiev City	Kiev		Kiev-Shevchenkivskyi	50.4646	30.4655	UA:Pershiy; 24 Channel	On 23 August 2020, about 500 people, including citizens of Belarus, gathered in Kiev-Shevchenkivskyi in support of anti-government protests in Belarus. [size=about 500]	0
40227	22 August 2020	Protests	Peaceful protest	Protesters (Ukraine)	National Corps Party			Europe	Ukraine	Odessa	Odessa Municipality		Odessa	46.4639	30.7386	National Corps	On 22 August 2020, people, including members of National Corps, protested in Odessa against construction on the territory of tennis courts. The protesters dismantled the construction fence. [size=no report]	0
40211	21 August 2020	Protests	Peaceful protest	Protesters (Ukraine)	Labour Group (Ukraine)			Europe	Ukraine	Chernivtsi	Chernivtsi Municipality		Chernivtsi	48.2915	25.9403	Segodnya; Novoye Vremya Ukraine	On 21 August 2020, several dozen entrepreneurs protested in Chernivtsi against possible new restrictions in relation to the coronavirus lockdown. [size=several dozen]	0
40225	20 August 2020	Protests	Peaceful protest	Protesters (Ukraine)				Europe	Ukraine	Kiev City	Kiev		Kiev-Pecherskyi	50.427	30.5454	Stop Corruption	On 20 August 2020, people protested outside a court in Kiev-Pecherskyi demanding responsibility for those who falsified results of the independent testing for admission to universities. [size=no report]	0
40213	20 August 2020	Protests	Peaceful protest	Protesters (Ukraine)	Svoboda; Government of Ukraine (2019-)			Europe	Ukraine	Ternopil	Ternopil		Ternopil	49.5559	25.6056	Svoboda	On 20 August 2020, members of Svoboda, including the city mayor, organised a protest in Ternopil in support of anti-government demonstrations in Belarus. [size=no report]	0
40220	20 August 2020	Protests	Peaceful protest	Protesters (Ukraine)	Svoboda			Europe	Ukraine	Ternopil	Monastyryska		Monastyryska	49.0891	25.1733	Svoboda	On 20 August 2020, members of Svoboda organised a protest in Monastyryska, Ternopil, in support of anti-government demonstrations in Belarus. [size=no report]	0
40222	20 August 2020	Protests	Peaceful protest	Protesters (Ukraine)	Svoboda; Government of Ukraine (2019-)			Europe	Ukraine	Sumy	Konotop		Konotop	51.2403	33.2026	Svoboda	On 20 August 2020, members of Svoboda, including the city mayor, organised a protest in Konotop, Sumy, in support of anti-government demonstrations in Belarus. More than 50 people participated. [size=more than 50]	0
40219	20 August 2020	Protests	Peaceful protest	Protesters (Ukraine)	Svoboda			Europe	Ukraine	Lviv	Zhovkva		Rava-Ruska	50.2313	23.6208	Svoboda	On 20 August 2020, members of Svoboda organised a protest in Rava-Ruska, Lviv, in support of anti-government demonstrations in Belarus. About 10 people participated. [size=about 10]	0
40215	20 August 2020	Protests	Peaceful protest	Protesters (Ukraine)	Svoboda; Government of Ukraine (2019-)			Europe	Ukraine	Ivano-Frankivsk	Ivano-Frankivsk Municipality		Ivano-Frankivsk	48.9215	24.7097	Svoboda	On 20 August 2020, members of Svoboda, including the city mayor and a member of Parliament, organised a protest of several dozen in Ivano-Frankivsk in support of anti-government demonstrations in Belarus. [size=several dozen]	0
40217	20 August 2020	Protests	Peaceful protest	Protesters (Ukraine)	Svoboda			Europe	Ukraine	Ivano-Frankivsk	Kosiv		Kosiv	48.3107	25.0958	Svoboda	On 20 August 2020, members of Svoboda organised a protest in Kosiv, Ivano-Frankivsk, in support of anti-government demonstrations in Belarus. [size=no report]	0
40218	20 August 2020	Protests	Peaceful protest	Protesters (Ukraine)	Svoboda			Europe	Ukraine	Lviv	Zhovkva		Dubliany	49.9026	24.0876	Svoboda	On 20 August 2020, members of Svoboda organised a protest in Dubliany, Lviv, in support of anti-government demonstrations in Belarus. [size=no report]	0
40216	20 August 2020	Protests	Peaceful protest	Protesters (Ukraine)	Svoboda			Europe	Ukraine	Volyn	Horokhiv		Berestechko	50.3585	25.1209	Svoboda	On 20 August 2020, members of Svoboda organised a protest in Berestechko, Volyn, in support of anti-government demonstrations in Belarus. [size=no report]	0
